[
  {
    "$schema": "https://swiftpieces.com/schema/registry-item.json",
    "name": "AssistantOrb",
    "slug": "assistant-orb",
    "type": "registry:component",
    "title": "Assistant Orb",
    "description": "A dark glass ball with a Siri-style voice wave inside, locked to the thinking state; four thin sine membranes travel through the equator of a refracting shell, drawn by a Metal color shader. The sphere never moves, only the wave, and a palette change crossfades its colours.",
    "category": "ai",
    "license": "MIT+Commons-Clause",
    "version": "1.2.0",
    "minIOSVersion": "17.0",
    "swiftToolsVersion": "6.1",
    "tags": [
      "ai",
      "orb",
      "shader",
      "metal",
      "thinking"
    ],
    "dependencies": [],
    "registryDependencies": [],
    "spmDependencies": [],
    "requiredCapabilities": [],
    "infoPlist": {},
    "assets": [],
    "shaders": [
      {
        "path": "registry/swift/ai/AssistantOrb.metal",
        "type": "registry:shader",
        "target": "SwiftPieces/AI/AssistantOrb.metal"
      }
    ],
    "files": [
      {
        "path": "registry/swift/ai/AssistantOrb.swift",
        "type": "registry:component",
        "target": "SwiftPieces/AI/AssistantOrb.swift"
      }
    ],
    "preview": {},
    "docs": "https://swiftpieces.com/docs/components/ai/assistant-orb",
    "isNew": false,
    "liquidGlass": false,
    "metal": true
  },
  {
    "$schema": "https://swiftpieces.com/schema/registry-item.json",
    "name": "PromptChips",
    "slug": "prompt-chips",
    "type": "registry:component",
    "title": "Prompt Chips",
    "description": "Liquid glass prompt chips above a composer, in a snapping horizontal row or a grid of columns, each keyed by a tinted glyph disc. They cascade in one after another as they appear. A tap presses the chip and swells it with a pop of its disc, and the other chips flow into it, nearest first, melting into its glass; then the gathered chip condenses into a drop that falls into the composer as the chips close, handing it the text.",
    "category": "ai",
    "license": "MIT+Commons-Clause",
    "version": "3.1.0",
    "minIOSVersion": "17.0",
    "swiftToolsVersion": "6.1",
    "tags": [
      "chips",
      "suggestions",
      "prompt",
      "scroll",
      "grid",
      "ai",
      "blocks"
    ],
    "dependencies": [],
    "registryDependencies": [],
    "spmDependencies": [],
    "requiredCapabilities": [],
    "infoPlist": {},
    "assets": [],
    "shaders": [],
    "files": [
      {
        "path": "registry/swift/ai/PromptChips.swift",
        "type": "registry:component",
        "target": "SwiftPieces/AI/PromptChips.swift"
      }
    ],
    "preview": {},
    "docs": "https://swiftpieces.com/docs/components/ai/prompt-chips",
    "pro": "prompt-composer",
    "isNew": false,
    "liquidGlass": true,
    "metal": false
  },
  {
    "$schema": "https://swiftpieces.com/schema/registry-item.json",
    "name": "SourceStack",
    "slug": "source-stack",
    "type": "registry:component",
    "title": "Source Stack",
    "description": "Citations for an AI answer: a compact pill of overlapping site badges and a source count that opens into a list of numbered source cards. The badges fly out of the stack into their cards as the list cascades in under them, each card opens its link with a press, and closing gathers the badges back into the pill.",
    "category": "ai",
    "license": "MIT+Commons-Clause",
    "version": "1.0.0",
    "minIOSVersion": "17.0",
    "swiftToolsVersion": "6.1",
    "tags": [
      "citations",
      "sources",
      "links",
      "references",
      "ai",
      "answer",
      "expand",
      "morph"
    ],
    "dependencies": [],
    "registryDependencies": [],
    "spmDependencies": [],
    "requiredCapabilities": [],
    "infoPlist": {},
    "assets": [],
    "shaders": [],
    "files": [
      {
        "path": "registry/swift/ai/SourceStack.swift",
        "type": "registry:component",
        "target": "SwiftPieces/AI/SourceStack.swift"
      }
    ],
    "preview": {},
    "docs": "https://swiftpieces.com/docs/components/ai/source-stack",
    "added": "2026-09-29",
    "isNew": false,
    "liquidGlass": false,
    "metal": false
  },
  {
    "$schema": "https://swiftpieces.com/schema/registry-item.json",
    "name": "StreamingReply",
    "slug": "streaming-reply",
    "type": "registry:component",
    "title": "Streaming Reply",
    "description": "The AI reply surface in liquid glass. A glass header pill carries the assistant mark and a phase label that morphs letter by letter, text arrives token by token with a per-word fade and a tinted cursor bubble, inline code sits on neutral chips, and user prompts are signal-tinted glass bubbles. A long press lifts the message: the header pill swells into a glass card around the reply and Copy and Regenerate bud out of its bottom edge, and a stopped reply buds a signal Retry out of its header pill.",
    "category": "ai",
    "license": "MIT+Commons-Clause",
    "version": "2.2.0",
    "minIOSVersion": "17.0",
    "swiftToolsVersion": "6.1",
    "tags": [
      "chat",
      "streaming",
      "markdown",
      "ai",
      "text-renderer",
      "blocks"
    ],
    "dependencies": [],
    "registryDependencies": [],
    "spmDependencies": [],
    "requiredCapabilities": [],
    "infoPlist": {},
    "assets": [],
    "shaders": [],
    "files": [
      {
        "path": "registry/swift/ai/StreamingReply.swift",
        "type": "registry:component",
        "target": "SwiftPieces/AI/StreamingReply.swift"
      }
    ],
    "preview": {},
    "docs": "https://swiftpieces.com/docs/components/ai/streaming-reply",
    "pro": "streaming-markdown",
    "isNew": false,
    "liquidGlass": true,
    "metal": false
  },
  {
    "$schema": "https://swiftpieces.com/schema/registry-item.json",
    "name": "ThinkingState",
    "slug": "thinking-state",
    "type": "registry:component",
    "title": "Thinking State",
    "description": "The \"assistant is working\" placeholder, laid out like the reply it becomes: a liquid glass header pill carrying a breathing mark and an elapsed-seconds label that morphs as it counts, over three presentations on one clock: block-colored rising dots, a sheen over reply-shaped bars, or a label whose glyphs carry the sheen. Plus a modifier that sweeps any view.",
    "category": "ai",
    "license": "MIT+Commons-Clause",
    "version": "2.2.0",
    "minIOSVersion": "17.0",
    "swiftToolsVersion": "6.1",
    "tags": [
      "loading",
      "thinking",
      "sheen",
      "placeholder",
      "ai",
      "elapsed"
    ],
    "dependencies": [],
    "registryDependencies": [],
    "spmDependencies": [],
    "requiredCapabilities": [],
    "infoPlist": {},
    "assets": [],
    "shaders": [],
    "files": [
      {
        "path": "registry/swift/ai/ThinkingState.swift",
        "type": "registry:component",
        "target": "SwiftPieces/AI/ThinkingState.swift"
      }
    ],
    "preview": {},
    "docs": "https://swiftpieces.com/docs/components/ai/thinking-state",
    "pro": "tool-execution-card",
    "isNew": false,
    "liquidGlass": true,
    "metal": false
  },
  {
    "$schema": "https://swiftpieces.com/schema/registry-item.json",
    "name": "ThoughtOrb",
    "slug": "thought-orb",
    "type": "registry:component",
    "title": "Thought Orb",
    "description": "A small dark glass ball with a Siri-style voice wave inside, locked to the thinking state and drawn by a Metal color shader; palettes for searching, reading and writing crossfade the colour with the kind of work. Its Pill is the status control in liquid glass: the mark rides a round glass bubble joined by a liquid neck to a capsule whose label morphs letter by letter into each new verb while the capsule reshapes around it, with indeterminate dots at its end.",
    "category": "ai",
    "license": "MIT+Commons-Clause",
    "version": "1.2.0",
    "minIOSVersion": "17.0",
    "swiftToolsVersion": "6.1",
    "tags": [
      "ai",
      "orb",
      "shader",
      "metal",
      "thinking",
      "status"
    ],
    "dependencies": [],
    "registryDependencies": [],
    "spmDependencies": [],
    "requiredCapabilities": [],
    "infoPlist": {},
    "assets": [],
    "shaders": [
      {
        "path": "registry/swift/ai/ThoughtOrb.metal",
        "type": "registry:shader",
        "target": "SwiftPieces/AI/ThoughtOrb.metal"
      }
    ],
    "files": [
      {
        "path": "registry/swift/ai/ThoughtOrb.swift",
        "type": "registry:component",
        "target": "SwiftPieces/AI/ThoughtOrb.swift"
      }
    ],
    "preview": {},
    "docs": "https://swiftpieces.com/docs/components/ai/thought-orb",
    "isNew": false,
    "liquidGlass": true,
    "metal": true
  },
  {
    "$schema": "https://swiftpieces.com/schema/registry-item.json",
    "name": "Silk",
    "slug": "silk",
    "type": "registry:component",
    "title": "Silk",
    "description": "A slowly folding silk surface lit by a movable light and shaded from a real gradient normal in a Metal shader, in house block fabrics (the brand red among them) and an adaptive standard style, with optional device-tilt lighting. Content only, so it carries no glass.",
    "category": "backgrounds",
    "license": "MIT+Commons-Clause",
    "version": "2.2.0",
    "minIOSVersion": "17.0",
    "swiftToolsVersion": "6.1",
    "tags": [
      "background",
      "shader",
      "silk",
      "motion",
      "loop",
      "palette"
    ],
    "dependencies": [],
    "registryDependencies": [],
    "spmDependencies": [],
    "requiredCapabilities": [],
    "infoPlist": {
      "NSMotionUsageDescription": "Moves the light across the silk as you tilt the device."
    },
    "assets": [],
    "shaders": [
      {
        "path": "registry/swift/backgrounds/Silk.metal",
        "type": "registry:shader",
        "target": "SwiftPieces/Backgrounds/Silk.metal"
      }
    ],
    "files": [
      {